,neg,neu,pos,compound
pemprov dki jakarta rencana pindah citayam fashion week kawasan scbd lokasi httpstcobfwvknjxyw,0.0,1.0,0.0,0.0
gak salty sih asli yg dtg lokasi citayam fashion week scbd tolong utk gak dompleng intervensi seru anak kesana ngonten ken main liatin gemerlap kota jakarta transportasi publik yg bagus,0.0,1.0,0.0,0.0
perhati gw pas era caelah era bonge kurma roy jeje dkk scbd tetiba ale yg notabene model freelance jalan zebra cross pan rame citayam fashion week httpstcoujpscisdtk,0.0,0.922,0.078,0.296
pria kemayu yg isebenarnya happening sdh yg tau scbd jadi konten pansos gabener dki isu lgbt redam buka selesai bahan konten kasihan httpstcommkauwai,0.0,1.0,0.0,0.0
alunalun cilacap fashion week acfw car free day cfd alunalun cilacap minggu juli jam wib alunaluncilacapfashionweek acfw scbd scbdsudirman scbd jakarta scbd jakarta scbdfashionweek scbdlyfe scbdviral scbdictionary scbdancecompany acfw httpstcorurvmggck,0.0,0.898,0.102,0.5106
aniesbaswedan streetstyle ala fashion citayam bilang eksentrik citayamfashion show httpstcohmnmjtotyi,0.0,1.0,0.0,0.0
kawan tambang pakai outfit gratis gin fashion week scbd engga sih httpstcowyayrgigf,0.0,0.902,0.098,0.0516
introvert spt ku pusing kek kalo citayem fashion week scbd hahhahaha httpstconctzugxos,0.0,1.0,0.0,0.0
fenomena scbd amp citayam fashion week keren nikmat organik but this katro httpstcoxmjonhdi,0.0,1.0,0.0,0.0
undulh fashion week scbd bukti gaya moral akhlak miris,0.0,1.0,0.0,0.0
presiden jokowi dukung penuh citayam fashion week scbd httpstcoeizjfrvd,0.0,1.0,0.0,0.0
ikut fashion week scbd tpi outfitnya gamis doang,0.0,1.0,0.0,0.0
scbd fashion week buka mata telinga buat bijak bupatiwali kotagubernur presiden perhati sedia fasilitas sosial sebanyaknyabukan mall hutan kota tanah lapang,0.0,1.0,0.0,0.0
wakil gubernur dki jakarta pikir opsi cari lokasi selenggara aga busana jalan citayam fashion week dukuh httpstcomkewvpau,0.0,1.0,0.0,0.0
alunalun cilacap fashion week acfw car free day cfd alunalun cilacap minggu juli jam wib alunaluncilacapfashionweek acfw scbd scbdsudirman scbd jakarta scbd jakarta scbdfashionweek scbdlyfe scbdviral scbdictionary scbdancecompany httpstcolsnkoescm,0.0,0.895,0.105,0.5106
wagub dki wacana alternatif fashion week anak scbd lokasi httpstcopkxaoxmdbm,0.0,1.0,0.0,0.0
puncak fashion week macet nya pindah scbd puncak bogor rindualam bogorroadbike bogorcycling bogorbersepeda httpstcortujuqucbl,0.0,1.0,0.0,0.0
rt detikcom jual kopi keliling kenal starling toriman ngaku hari uang rp ribu ramai,0.0,1.0,0.0,0.0
ganggu tertib wagub dki jakarta ahmad riza patria timbang pindah lokasi giat citayam fashion week remaja sudirman citayam bogor depok scbd kawasan stasiun mrt dukuh jakarta pusat httpstcohkfecpbo,0.0,1.0,0.0,0.0
citayem fashion week gk seru kalo org duit ikut anjirudah bagus main daerah senopati ikut scbd,0.0,1.0,0.0,0.0
presiden joko widodo dukung penuh citayam fashion week scbdjokowi jokowidodo scbd citayamfashionweek fashion trending opsimediatv httpstcogkudasoz,0.0,1.0,0.0,0.0
wakil gubernur dki jakarta ahmad riza patria timbang pindah lokasi giat citayam fashion week remaja sudirman citayam bogor depok scbd kawasan stasiun mrt dukuh jakarta pusat httpstcouuzjgmvxgn,0.0,1.0,0.0,0.0
pasukin citayem fashion week nih komedian putarkomedi playslots riplion percumalaporpolisi sange aaaaaaaaa darari citayamfasionweek extraordinaryattorneywooep malemjumat barujadian tangkapferdysambo laptopdarishopee mynameisnanon scbd citayemfashionweek httpstcovlxcqfhbys,0.0,1.0,0.0,0.0
alunalun cilacap fashion week acfw car free day cfd alunalun cilacap minggu juli jam wib alunaluncilacapfashionweek acfw scbd scbdsudirman scbd jakarta scbd jakarta scbdfashionweek scbdlyfe scbdviral scbdictionary scbdancecompany httpstcorfrlsd,0.0,0.895,0.105,0.5106
presiden jokowi komentar citayam fashion week scbd jakarta httpstcowqdoaautm,0.0,1.0,0.0,0.0
kinoy scbd saing roy jeje slebew citayam fashion week httpstcoadacpttx,0.0,1.0,0.0,0.0
rt pipis kawasan dukuh rame bilang scbd sudirman citayam bojonggede depok trus event cfw citayam,0.0,1.0,0.0,0.0
santorinissun scbd fashion week komiditi yg seksi sisi imo jadi tidak siap mang kuasa utk tata gagap kreativitas samping gagap teknologi akut azis gagap,0.0,1.0,0.0,0.0
liat fenomena scbd fashion week w renung klo orang bangun popularitasreputasi banding bangun karakter pribadi refleksi nya jgn lupa bangun karakter trutama terap karakter tuhan dlm hidup,0.0,1.0,0.0,0.0
abbey road fashion week scbd citayamfashionweek httpstcocblbimbwe,0.0,1.0,0.0,0.0
wooxshik soon scbd fashion week ahaha,0.0,1.0,0.0,0.0
podcast ngomong politik kapital pemuda scbd akhirakhir istilah citayam fashion week viral kalang masyarakat warganet sosial media ada tuai pro kontra orang ganggu httpstcoeuufkyvckg,0.0,1.0,0.0,0.0
kocak tulang lunak arie untung pijat keras tulang buka praktek scbd berlenggaklenggok citayam fashion week abg presto kali ya httpstcoczfqwnkp,0.0,1.0,0.0,0.0
biang macet wagub dki cari alternatif citayam fashion week dukuh citayemfashionweek citayem dukuhatas scbd sudirman citayamfashionweek citayam httpstcoxsgealfml,0.0,1.0,0.0,0.0
scbd jd ajang fashion week kek mending bilang spot utk fashion street deh,0.0,1.0,0.0,0.0
laku remaja stasiun mrt dukuh jakarta timbul sikap pro kontra juluk remaja scbd sudirman citayam bojonggede depok giat kenal citayam fashion week httpstcotqeuejyq httpstcoczxoudhepq,0.0,1.0,0.0,0.0
citayam fashion week kawasan dukuh jakarta pusat jakpus kian trend ikut bocah scbd sudirman citayam bojong depok simak berita lengkap httpstcosszukauy newsone cariberitaditvone httpstcovnddyvns,0.0,1.0,0.0,0.0
berita httpstcoqblwdqjd ratus remaja komunitas sudirman citayam bojong gede depok scbd sabtu malam gelar citayam fashion week sayang giat timbul macet pungli liputansctv httpstcoatjrialfkc,0.0,1.0,0.0,0.0
wakil gubernur dki jakarta ahmad riza patria unjung sekitar lintas sudirmandukuh lokasi citayam fashion week remaja sudirman citayam bojonggede depok scbd lengkap httpstcolzdfgo httpstcoaiiawffcpq,0.0,1.0,0.0,0.0
citayam fashion week scbd tren yg ulang jaman an nama lintas lawa beda gak tulang lunak httpstcopiprnwvk,0.0,1.0,0.0,0.0
udahlah aniesbaswedan acara scbd citayam fashion week udah ga seru lg bubarin kasih khusus jgn jalan raya,0.0,1.0,0.0,0.0
pagi kunjung dukuh jkt scbd citayam fashion week viral bnyk tkh kunjung kawasan anies ridwan kamil wakil presiden ue rombong berkat kreativitas medsos giat remaja dunia harajuku jepang kontes httpstcoaqmysgg,0.0,1.0,0.0,0.0
pagi kunjung scbd citayam fashion week dukuh jakarta yg viral dunia berkat kreativitas media sosial dukuh harajuku jepang yg ramai fashion week remaja jepang httpstcotfiyort,0.0,1.0,0.0,0.0
scbd sudirman central busines district scbd sekitar citayam bogor depok citayam fashion week seru kalo benerbener anak scbd citayam scbd sudirman norak latah kebelet viral ranah udah apple to apple budget,0.0,1.0,0.0,0.0
pagi dukuh jakarta scbd citayam fashion week yg viral kali tdk dominasi remaja dgn pakai nyentrik ikut ibuibu yg tampil boleh lenggaklenggok tdk tinggal httpstcomydzxfeq,0.0,1.0,0.0,0.0
kawasan sudirman scbd lekat dgn image eksekutif muda patah dgn fenomena citayam fashion week skrg pindah pik yg image nya konglomerat patah lg,0.0,1.0,0.0,0.0
podcast ngomong politik kapital pemuda scbd akhir istilah citayam fashion week viral kalang masyarakat warganet sosial media ada tuai pro kontra orang yg ganggu fenomena httpstcoocipriqh,0.0,1.0,0.0,0.0
rt leehl hi scbdfw good morning rate outfitku scbd fashion week httpstcosjutmiceya,0.0,0.791,0.209,0.4404
pro kontra scbd fashion week bgt ya httpstcoticjobok,0.0,1.0,0.0,0.0
masyarakat dki jakarta aku risih fenomena remaja sudirman citayam bojonggede depok scbd aktivitas citayam fashion week kawasan dukuh jakarta pusat dkijakarta nongkrong scbd updatebali httpstcowvbzdhhgd httpstcoebhjbmoy,0.0,1.0,0.0,0.0
rt trendusara mas tum agusyudhoyono fashion week ajak sbyudhoyono bareng mas gub aniesbaswedan scbd dapse cc in om,0.0,1.0,0.0,0.0
rt ninosanada mas tum agusyudhoyono fashion week ajak sbyudhoyono bareng mas gub aniesbaswedan scbd scbdfasionweek,0.0,1.0,0.0,0.0
scbdfw good morning rate outfitku scbd fashion week httpstcosjutmiceya,0.0,0.734,0.266,0.4404
rt maman scbd sudirman capres bojonggede depok fashion week httpstcosuoooblm,0.0,1.0,0.0,0.0
wdyt ngegembel scbd liat fashion week httpstcowqqnhdm,0.0,1.0,0.0,0.0
pesan utama jokowi fenomena citayam fashion week remaja scbd jakarta httpstcodczsbdkkj,0.0,1.0,0.0,0.0
besok senin adikadik lupa masuk sekolah yaa httpstcobsficipy,0.0,1.0,0.0,0.0
ayo dng jujur yg citayam fashion week scbd apresiasi menparkeraf dukung yg aktivitas sana giat baca alquran aji apresiasi usir yg menparkeraf detasemen khusus httpstcocvyxwrj,0.0,1.0,0.0,0.0
rt liputandotcom wagub ahmad riza patria prinsip pemprov dki jakarta coba cari solusi baik muda,0.0,1.0,0.0,0.0
sisi gelap citayam fashion week krisis tauladan orang tua negara scbd potensipemudadibajak httpstcovjiumyx,0.0,1.0,0.0,0.0
tren scbd fashion week ya bgt hatersnya yg ngatain norak selera fashion gak kl nyaman make baju ya biarin ekspres,0.0,1.0,0.0,0.0
citayam fashion week bubar jelang malam remaja scbd tinggal cerita manis httpstcozoepicw httpstcozdnrizuel cerita,0.0,1.0,0.0,0.0
remi bonge cs kabar mindahin citayam fashion week pik dlm krn scbd uda padet bgt kayak duta nongkrong cs nih sosialisasi temen ya goodweekend,0.0,1.0,0.0,0.0
bikinin logo yg viral jeje slebew citayem fashion week scbd sisablengg luculucuvideo bangun recehkantwitter logodesign httpstcojbgahtsv,0.0,1.0,0.0,0.0
wagub ahmad riza patria prinsip pemprov dki jakarta coba cari solusi baik mudamudi scbd httpstcovppigpwmev,0.0,1.0,0.0,0.0
txtdaribandung tarik fenomena citayam fashion week orang aja anggap norak jamet yg gak fashion show kawasan sudirman scbd yg lekat image eksekutif muda patah jad lucu,0.0,1.0,0.0,0.0
viral ya ciri khas pakai anak scbdnya kalo influencer sampe artis ikut situ baju brand luxury ya ilang ciri khas si citayem fashion weeknya kalo ikut ya nyesuain ciri khas anak situ httpstcofvjnrhur,0.0,1.0,0.0,0.0
anak scbd citayam fashion week sadar rubah lokasi njop nilai jual objek pajak ubah ubah dlm struktur pemerintahankepolisian tambah personil yg tugas market potensial buru cuan dtwb daerah tuju wisata,0.0,1.0,0.0,0.0
rt antaranews scbd citayem fashion week httpstcoxbulhvq,0.0,1.0,0.0,0.0
aneh nya negeri gubernur perhati scbd fashion week httpstcodafjaiedwd,0.0,1.0,0.0,0.0
dakwah on the street warna citayam fashion week scbd httpstcofrfnkynta,0.0,1.0,0.0,0.0
dakwah on the street warna citayam fashion week scbd httpstcofnmvqmxpe httpstcowbemhthr,0.0,1.0,0.0,0.0
assalamualaikum gub aniesbaswedan dkijakarta satpolpp dki mohon ada bersih kawasan scbd cfw sudirman citayam bojong gede depok citayam fashion week makhluk tulang lunak homo bencong lesbi edar narkoba miras cepat httpstcoaindpfoojg,0.0,1.0,0.0,0.0
rt mediamonitor citayam fashion week bubar jelang malam cerita remaja scbd httpstcoosldohsfg,0.0,1.0,0.0,0.0
citayam fashion week bubar jelang malam cerita remaja scbd httpstcoosldohsfg,0.0,1.0,0.0,0.0
presiden jokowi tanggap fenomena remaja sudirman citayam bojong gede depok scbd kerap gelar ajang citayam fashion week kawasan dukuh sudirman jakarta jokowi presidenjokowi citayamfashionweek scbd sudirman jakarta httpstcoozyrxptt,0.0,1.0,0.0,0.0
achyanf ismailhasannst bang list artis yg fomo scbd fashion week biar kite ni netizen silaturahmi,0.0,1.0,0.0,0.0
rt catchmeupid beb ngerasa nggak semenjak fenomena citayem fashion week mbakmbak scbd tuh udah geser gitu terminolog,0.0,1.0,0.0,0.0
scbd citayam fashion week resah si kaya ikut nyoba eks,0.0,1.0,0.0,0.0
rt fessthai ftd chi pas scbd citayem fashion week httpstcotgjqibag,0.0,1.0,0.0,0.0
kl dah gin ad yg bilang gak papa kreativitas scbd fashion week ajang normalisasi l mikir httpstcoqlodpzmzw,0.0,1.0,0.0,0.0
tren scbd sudirman citayam bojong depok inspirasi remaja citayam fashion week kawasan dukuh jakarta pusat banjir unjung wilayah jabodetabek httpstcoqtdxmvppz,0.0,1.0,0.0,0.0
jokowi angkat suara kait citayam fashion week kreativitas larang hmmm gimana yaa jokowi baca lengkap httpstcormbomgrbxh beritaterkini media news breakingnews jokowi scbd citayamfashionweek fashionweek kreativitas indonesia,0.0,1.0,0.0,0.0
monchantik scbd fashion week ya,0.0,1.0,0.0,0.0
seraimai citayam fashion week dukuh lengkap httpstcohpcizxgbns dukuhatas citayamfashionweek citayam scbd,0.0,1.0,0.0,0.0
wakil gubernur dki jakarta ahmad riza patria sambang langsung citayam fashion week cfw langsung padat massa tren scbd kawasan dukuh jakarta pusat sabtu malam juli httpstcokyruvynim,0.0,1.0,0.0,0.0
nodamembundle nih support citayem fashion week askskskskksk feeling gue dr udah gaenak pas scbd rame,0.0,0.756,0.244,0.4939
jokowi blakblakan citayam fashion week khan kreatif larang httpstcovxspzung presidenjokowi citayamfashionweek dukuhatas scbd pemkotjakpus jakartapusat lensaindonesiacom,0.0,1.0,0.0,0.0
jisundae gyuriousss depok aja kalo gitu scbd fashion week sidoarjo amp cah bocah depok,0.0,1.0,0.0,0.0
mas tum agusyudhoyono fashion week ajak sbyudhoyono bareng mas gub aniesbaswedan scbd scbdfasionweek httpstcowgbkmvbnmi,0.0,1.0,0.0,0.0
divhumas polri tolong aparat bubar citayam fashion week scbd duku duku detik jam ramai ganggu lintas panggil mesponsori event bebas ijin ramai ivan gunawan dll lipu host trans tv,0.0,1.0,0.0,0.0
rara malam minggu scbd sudirman citayam fashion week coal getting mengunakan truck kapasitas nya httpstcouiusroo,0.0,1.0,0.0,0.0
wali kota pariaman genius umar tinggal tren anak muda istri citayam fashion week kawasan sudirman central business district scbd citayamfashionweek httpstcobojuxzjux,0.0,1.0,0.0,0.0
afrkml scbd liat fashion week wkwk,0.0,1.0,0.0,0.0
jalan sudirman scbd citayem fashion week eh ditawarin mie ayam gratis sm pemuda keren yg bagi salut sukses usaha httpstcomfmzsykkg,0.0,0.941,0.059,0.0516
trotoarian kuasa ibukota jalan macet karuan sudirman fashion week dukuh scbd padat gas tipistipis goters jeje kawankawan butuh bantu buru on httpstcopnewtb,0.0,1.0,0.0,0.0
lippo village karawaci tangerang fashion week model kg biar nggak macet plaza semanggi scbd tangerang bycycle habishujanterbitlahpelangi jakarta indonesia httpstcodgzlnokv,0.0,1.0,0.0,0.0
roughneck seru kampanye we are local heroes citayam fashion week kampanye bentuk apresiasi roughneck anakanak scbd httpstcophznqihplf,0.0,0.829,0.171,0.5106
selesai sudirman scbd pindah dukuh hbs pindah ratu plaza senayan bulunganmelawai finish kemangdemikian kronologi socialmovement citayam fashion week,0.0,1.0,0.0,0.0
citayem fashion week ride scbd sudirman south jakarta httpstcoyoltaouga,0.0,1.0,0.0,0.0
rt el jusuf citayam fashion week scbd httpstcoybmyqynxo,0.0,1.0,0.0,0.0
wakil gubernur dki ahmad riza patria abg scbd kerap gelar citayam fashion week zebra cross catwalk kumparannews httpstcopdgfkrrcch,0.0,1.0,0.0,0.0
rt pikir rakyat arie untung komentar fenomena citayam fashion week tulang remaja scbd lunak httpstcoclrhfmdvcd,0.0,1.0,0.0,0.0
alvnptr anak scbd fashion week yg viral,0.0,1.0,0.0,0.0
artis elly sugigi dukung remaja ekspresi model pagelaran citayam fashion week kawasan sudirman citayam bojong gede depok scbd dukuh jakarta pusat httpstcorepcxqd,0.0,1.0,0.0,0.0
httpstcocplynwbwbs citayam fashion week gera street fashion anakanak muda kawasan sudirman central business district scbd usung konsep harajuku ala jepang jokowi httpstcoaxglvb,0.0,1.0,0.0,0.0
scbd citayem fashion week httpstcoxbulhvq,0.0,1.0,0.0,0.0
nctzenbase maaf banget ya nder maaf kayak roy scbd citayem fashion week,0.0,1.0,0.0,0.0
capebgt mama fashion week scbd stelan nya pake outfit cewe kue pink kuning,0.0,1.0,0.0,0.0
tretanmuslim org citayam bikin rame scbd skarang ganti yg org scbd bikin fashion week citayem sono,0.0,1.0,0.0,0.0
presiden joko widodo jokowi angkat bicara fenomena remajaremaja busana nyentrik kumpul stasiun mrt dukuh jakarta juluk remaja scbd sudirman citayam bojonggede depok httpstcoxfqhlzbifo httpstcojjehgxu,0.0,1.0,0.0,0.0
foto citayam fashion week oiya gaess fenomena scbd amp cfw sy ladang dakwah asatidz amp teman muda hijrah dakwah on the street hijab gratis dsj lepas roadshow sulteng sy mampir deh cfwslebeeeww httpstcoddhzruqd,0.0,0.964,0.036,0.0516
askrlfess huftt pdhl ak lbii suka citayem fashion week sieee scbd httpstcoqafbmv,0.0,1.0,0.0,0.0
rt purnawarta httpstcosklzmwtew,0.0,1.0,0.0,0.0
tiga citayem fashion week ada daerah scbd remaja yg nongkrong situ ga anak citayam siapa nama mantan bonge,0.0,1.0,0.0,0.0
citayam fashion week scbd ya mbul wkwk httpstcogtjwukrh,0.0,1.0,0.0,0.0
citayem fashion week citayemfashionweek citayem scbd fashion httpstcoaplylmpezl,0.0,1.0,0.0,0.0
httpstcosklzmwtew,0.0,1.0,0.0,0.0
scbd citayam fashion week httpstcovkfwxdg,0.0,1.0,0.0,0.0
ashesattracts abis nonton scbd fashion week,0.0,1.0,0.0,0.0
avril lavigne here complicated mv just reminds me of citayamcitayem fashion week in scbd lmao httpstcoyzsveavbva,0.0,0.794,0.206,0.5994
okeh markimul mari kiya fenomena citayem fashion week ajang adu outfit anak muda yg nongkrong daerah scbd cetus jam wib,0.0,1.0,0.0,0.0
fenomena citayem fashion week kak jeje kak bonge menginfluence anak muda daerah scbd berbondongbondong unjuk skill dunia fashion perintah dki jakarta dinas lingkung hidup dki httpstcoujptanjb,0.0,1.0,0.0,0.0
dokumentasi citayam fashion week reporter asshireen fiqiakhmaadf citayamfashionweek sudirman scbd bnidukuhatas slebew citayemogahdiem citayam jeje bonge kurma roy httpstcoypngnyjgf httpstcoqoafnggjy,0.0,1.0,0.0,0.0
arjuna kulon ragilsemar aniesbaswedan ridwankamil anisbaswedan nama citayam fashion week laksana jalan sudirman scbd jakarta,0.0,1.0,0.0,0.0
imcmushroom si mencreeet piknik scbd fashion week citayam,0.0,1.0,0.0,0.0
hollyhalfme scbd ya citayem fashion week,0.0,1.0,0.0,0.0
rt hantiww min txtdarisukabumi liat dago geura udah kaya scbd fashion week kadi degem hungkul anu pake ootd,0.0,1.0,0.0,0.0
rt dirku kreatifitas dukung kunci positif takmelanggarhukum citayamfashionweek scbd percayajokowi httpst,0.0,1.0,0.0,0.0
scbdcitayem fashion week ubah anak jaksel fashion show udah ga asik anak citayem pindah pik ktanya wkwkwkwk,0.0,1.0,0.0,0.0
atur presiden gubernur salah guna wewenang udah tau jalan jadi fashion dukung presiden gubernur presiden gubernur dukung salah rugi negara by raja yunan httpstcobjihtexgiz,0.0,1.0,0.0,0.0
rt tfjakarta scbd fashion week rencana pindah pik bingung pik transportasi simak konten dtkj,0.0,1.0,0.0,0.0
kawasan dukuh rame bilang scbd sudirman citayam bojonggede depok trus event cfw citayam fashion week istilah yg asik sebut nama area yg penuh anak muda gaya busana ekspresif haradukuh httpstcobxpalqypot,0.0,1.0,0.0,0.0
scbd sukabumi cibadak fashion week httpstcoutmtwxlpx,0.0,1.0,0.0,0.0
ftd chi pas scbd citayem fashion week httpstcotgjqibag,0.0,1.0,0.0,0.0
min txtdarisukabumi liat dago geura udah kaya scbd fashion week kadi degem hungkul anu pake ootd,0.0,1.0,0.0,0.0
sebenernya citayam fashion week scbd semarang tepat kota anak muda trend fashion gak ikon yg viral aja jeje bonge roy,0.0,1.0,0.0,0.0
paula verhoeven baim uang rp juta bonge acara citayam fashion week resmi httpstcozxrwmcar gtvnews paulaverhoeven baimpaula bonge citayamfashionweek sudirman dukuhatas jakarta scbd httpstcolepjuejh,0.0,1.0,0.0,0.0
kasihan bonge cs gusur yg selebgram yutuber model profesional yg ikut numoang tenar citayen fashion week kawasan scbd emang ya kelas bisa numpang tenar,0.0,1.0,0.0,0.0
ken scbd lihat fashion week,0.0,1.0,0.0,0.0
scbd citayem fashion week refleksi street culture era an mana jalan kreasi breakdance skateboard kongkow dll,0.0,1.0,0.0,0.0
anakanak scbd fashion week bonge cs dsb bikin komik seru kek cerita kelompok remaja yg dobrak dunia fasyun branded gemerlap influencer amp selebriti ibukota gaya hype dominasi social media wew,0.0,1.0,0.0,0.0
rt pchaeyoungc sunday lets go to scbd citaayam fashion week brodi httpstcocwzpotq,0.0,1.0,0.0,0.0
chinnarats lupitanyongorr he em lapang banteng fashion week donk scbd legessss,0.0,1.0,0.0,0.0
citayam fashion week scbd httpstcoybmyqynxo,0.0,1.0,0.0,0.0
ngikutin trend scbd daerah citayem fashion week jarang motor ama mobil wkwkw httpstcorejebjwjgg,0.0,1.0,0.0,0.0
lbh pb semmi gurun arisastra angkat bicara kait fenomena anak muda kumpul gaya kawasan sudirman central busines district scbd kenal citayam fashion week pb semmi citayamfashionweek scbd dukuhatas httpstcovhvpmbw,0.0,1.0,0.0,0.0
fenomena scbd citayam fashion week fenomena subkultur bentuk nikmat musik musisi indie akibat pengaruh budaya kreasi pecandukbfm httpstcomawoqozo,0.0,1.0,0.0,0.0
singgung reaksi negatif remaja scbd citayam fashion week jokowi kreatif ramai httpstcoxghmtrco,0.0,1.0,0.0,0.0
scbd fashion week scbdfashionweek equity tower httpstcodghajvtwzd,0.0,1.0,0.0,0.0
rt halamegawati yg ngetrend kalang anak mudafashion week scbd yukkks aah muda mud pdemokrat ramai yu,0.0,1.0,0.0,0.0
nonton scbd fashion week ah,0.0,1.0,0.0,0.0
scbd fashion week equity tower httpstcorjtooamw,0.0,1.0,0.0,0.0
tinggal chika jessica rina nose ramai citayam fashion week scbd httpstcohjyfxnvgm,0.0,1.0,0.0,0.0
penasaran jakarta invasi anak kota satelit scbd fashion week anak jakarta tulen mana,0.0,1.0,0.0,0.0
presiden jokowi apresiasi fenomena citayam fashion week scbd larang httpstcougorzayqxj,0.0,1.0,0.0,0.0
miss fancy curi perhati scbd fashion week tampil fashion show httpstcotoqxwiozo,0.138,0.862,0.0,-0.1531
yuizeyu fashion cocok kalang kaum kena hijab tinggal pinjam hoodie ayang mu aja kalo ga ayang ya not my business lahh nadine tampil scbd fashion week remajakece httpstcondlmdmednz,0.0,1.0,0.0,0.0
kreatifitas dukung kunci positif takmelanggarhukum citayamfashionweek scbd percayajokowi httpstcoalimdaux,0.0,1.0,0.0,0.0
miss fancy curi perhati scbd fashion week tampil fashion show httpstcojjrrezwwb,0.138,0.862,0.0,-0.1531
presiden tanggap fenomena citayam fashion week remaja scbd httpstconltkjfnmo,0.0,1.0,0.0,0.0
kuy ready bo purwokerto gempa hujan es panas semarang jogja solo brondong sange tante vcs avail nikita scbd citayem fashion week,0.0,0.889,0.111,0.3612
jokowi tanggap fenomena citayam fashion week lampu hijau httpstcoykksbzj citayamfashionweek jokowi scbd,0.0,1.0,0.0,0.0
presiden jokowi dukung citayam fashion week presiden ri jokowi joko widodo dukung positif fenomena citayam fashion week gelar area zebra cross area scbd jakarta httpstcojkwrgoiqd beritabaik timesindonesia ketahananinformasi,0.0,1.0,0.0,0.0
presiden jokowi dukung penuh citayam fashion week scbd httpstcoeizjfqqlqv,0.0,1.0,0.0,0.0
rt wahananewsdotco polisi awas citayam fashion week bogor httpstcostdfdt citayamfashionweek fashionweek,0.0,1.0,0.0,0.0
polisi awas citayam fashion week bogor httpstcostdfdt citayamfashionweek fashionweek bogor scbd,0.0,1.0,0.0,0.0
rt deludedogs anjeng gk twitter wibu goblok facebook goreng scbd fashion week pake isu lgbt krn gk bis,0.0,1.0,0.0,0.0
jual kopi keliling kenal starling toriman ngaku hari uang rp ribu ramai citayam fashion week httpstconyalhzhvd,0.0,1.0,0.0,0.0
anjeng gk twitter wibu goblok facebook goreng scbd fashion week pake isu lgbt krn gk bedain lgbt beneran model laki yg finis,0.0,1.0,0.0,0.0
jual kopi keliling kenal starling toriman ngaku hari uang rp ribu ramai citayam fashion week httpstcombrerjpb,0.0,1.0,0.0,0.0
gegara ngobrolin trip jogjasolo nemu foto cewe stylist tawangmangu cikal citayam fashion week scbd citayamfashionweek httpstcoydsxfnts,0.0,1.0,0.0,0.0
jokowi dukung remaja scbd gelar citayam fashion week tabrak atur larang httpstcowrlnphyrk,0.0,1.0,0.0,0.0
lenggaklenggok bak catwalk scbd fashion week ramai fokus fenomena scbd fashion week ramai unjung citayam bojong depok lho indosiartv httpstcowecicp,0.0,1.0,0.0,0.0
rt bogordaily net sisi gelap citayem fashion week gema media sosial potret abg gelimpang pinggir jalan kapar tertid,0.0,1.0,0.0,0.0
citayam fashion week scbd on progress httpstcoygqnftbdj,0.0,0.682,0.318,0.4215
presiden jokowi giat citayam fashion week gelar anakanak sudirman citayam bojonggede depok scbd baca lengkap httpstcokvvygmmqx citayamfashionweek,0.0,1.0,0.0,0.0
jokowi komentar tren citayam fashion week positif ngga presiden joko widodo jokowi komentar trend citayam fashion week gempar httpstcoqcelrbnh news jokowi aniesbaswedan scbd citayamfashionweek,0.0,1.0,0.0,0.0
sbyfess iki tren loki citayam fashion week nak scbd,0.0,1.0,0.0,0.0
jisoolimi scbd iya kak lokasi citayem fashion week,0.0,1.0,0.0,0.0
rt hasrizalhasriz sore wawancara inews topic fashion show week scbd httpstcocqcdchak,0.2,0.8,0.0,-0.3612
cmon citayam brothers amp sisters be brave and take over the real scbd i wanna see fashion week in front of pacific place httpstcocklzqxjkz,0.0,0.866,0.134,0.5267
kocom nuicemedia weechankawai oh pantesan kemarin kang emil nyobain street walk citayam fashion week kek survei tingkat bahagia warga scbd kalo join jakarta hmmm,0.0,0.913,0.087,0.296
polres jakpus citayam fashion week langgar uu lintas citayemfashionweek citayam citayamfashionweek sudirman scbd polres jakarta httpstconstedll,0.0,1.0,0.0,0.0
rt videotribun scbd fashion week aga busana sederhana scbd fashionweek fashionshow citayemfashionweek baca selen,0.0,1.0,0.0,0.0
rt wahyu uniform aabelkarimi acehselatansatu dua positif baca al quran positif dakwahsyiar peningkatah imtaq,0.0,1.0,0.0,0.0
aniesbaswedan feryfarhati dkpkpjakarta kotajakut scbd citayem fashion week ajang kumpul lgbt mohon tindak lanjut stop tdk kumpul kumpul gaya pacar bebas laki laki pakai perempuan orang sakit diobatin kasih punggung terima kasih dengar keluh warga,0.061,0.939,0.0,-0.296
udah gub aniesbaswedan arizapatria dkijakarta satpolpp dki tertib fashion week citayam scbd yg udah bablas httpstcoxnusdyg,0.0,1.0,0.0,0.0
scbd fashion week aga busana sederhana scbd fashionweek fashionshow citayemfashionweek baca selengkapnyagt httpstcogzeaijxr httpstcojbrlgjcal,0.0,1.0,0.0,0.0
